{
  "$schema": "https://schema.evideris.com/schemas/scoring-tool.schema.json",
  "$id": "https://schema.evideris.com/esge/scoring-tool/sydney-dmi.v1.0.0.json",
  "lineageId": "st-sydney-dmi",
  "type": "scoringTool",
  "version": "1.0.0",
  "release": "r2026.07",
  "supersedes": null,
  "supersededBy": null,
  "language": ["en"],

  "title": { "en": "Sydney Deep Mural Injury (DMI) classification" },
  "description": { "en": "Five-grade endoscopic classification of deep mural injury observed in the post-EMR defect, used to guide clip closure and predict the risk of delayed perforation." },
  "domain": "post-emr-defect-injury",

  "scale": {
    "kind": "ordinal",
    "bands": [
      { "label": { "en": "Type 0 — normal exposed submucosa" } },
      { "label": { "en": "Type I — muscularis propria fibres visible without injury" } },
      { "label": { "en": "Type II — focal loss of muscularis propria architecture (\"target sign\" on the resected specimen)" } },
      { "label": { "en": "Type III — actual hole/perforation but no contamination" } },
      { "label": { "en": "Type IV — perforation with contamination" } },
      { "label": { "en": "Type V — perforation with peritoneal contamination" } }
    ]
  },

  "inputs": [
    {
      "name": "grade",
      "label": { "en": "Sydney DMI grade" },
      "values": [
        { "score": 0, "label": { "en": "0 — Normal" } },
        { "score": 1, "label": { "en": "I — Visible muscularis, intact" } },
        { "score": 2, "label": { "en": "II — Focal injury (target sign)" } },
        { "score": 3, "label": { "en": "III — Hole, no contamination" } },
        { "score": 4, "label": { "en": "IV — Hole with contamination" } },
        { "score": 5, "label": { "en": "V — Peritoneal contamination" } }
      ]
    }
  ],

  "references": [
    {
      "id": "ref-burgess-2017",
      "citation": "Burgess NG, Bassan MS, McLeod D et al. Deep mural injury and perforation after colonic endoscopic mucosal resection: a new classification and analysis of risk factors. Gut 2017; 66: 1779–1789"
    }
  ]
}
